{
  "$schema": "https://json-schema.org/draft/2020-12/schema",
  "title": "Fideon canonical schema - bopgl (policy_check)",
  "description": "SPEC_21 section 4 canonical schema for bopgl, businessowners liability (L1 code bopgl), composing common_model.json 1.4.0 by $ref: the envelope plus the locations and buildings blocks. Built from the 13 single-LOB documents of the source-data bopgl folder (5 folders, read in place): the 8 with a native text layer (coterie 6, Leatherstocking 2) print the whole businessowners declarations, Section I property beside Section II liability, so the line's coverage codes name both; the other 5 are page images under an OCR text layer (4 agency-system prints and one coterie policy). Every field of the pre-SPEC_21 bopgl.json (bopgl.crosswalk.yaml). Package documents (bopgl_boppr) are not read for this schema. No LOB block. 2.2.0 adds the G1/bop review: the two businessowners declarations of that folder (Utica First, NYCM) were read for coverage names and field captions.",
  "fideon:doc_type": "policy_check",
  "fideon:lob": "bopgl",
  "fideon:lob_code": "TBD",
  "fideon:layout_family": "property_pkg",
  "fideon:schema_version": "2.3.0",
  "fideon:common_model_version": "1.4.0",
  "fideon:status": "SPEC_21 Phase 2 schema (10 October 2026), built from 8 native seed documents of 2 carriers; replaces the pre-SPEC_21 bopgl.json (_common-shaped). Draft for the project owner's approval; the seed golds drafted against it are DRAFT, pending reviewer sign-off. 2.1.0 (23 October 2026, additive, DECISIONS row 114/115): composes common model 1.4.0; adds Section I coverage codes that businessowners declarations print and the line lacked (collapse, glass expense, lease assessment, theft damage to building, spoilage, utility services, water damage, the two percentage increases), cross-copies printed row names between bopgl and boppr, and four field captions. No path, code or alias is removed or renamed, so the 2.0.0 golds, varmaps and readers keep working; each seed's review stamp is for the seed reviewer to renew. 2.2.0 (25 October 2026, additive, G1/bop folder): coverage-code names printed by the Utica First Businessowners Special Policy (with its Maximizer package endorsement) and the NYCM BP 00 03 declarations become aliases of the existing codes, ten concepts no code covered get a code on both lines, bopgl gets the counterparts of fifteen boppr codes, and distinctive field captions are added. No path, code or alias is removed or renamed, so the 2.1.0 golds, varmaps and readers keep working. 2.3.0 (26 October 2026, additive): coverage-code names and codes for the coverage rows printed by the G1 scanned and hybrid seed documents (change request approved by the project owner). No path, code or alias is removed or renamed.",
  "fideon:built_from": {
    "seed_golds": 8,
    "carriers": [
      "coterie",
      "Leatherstocking Cooperative Insurance Company"
    ],
    "legacy_schema": "bopgl.json (pre-SPEC_21, _common-shaped, business_liability_coverage_part)",
    "registry_yamls": [
      "bopgl"
    ],
    "corpora": [
      "synth_core/fideon/synth_core/data/source data/<Carrier>/bopgl/ (13 documents; 8 native seeds, 5 page images under an OCR text layer)",
      "G1/bop (6 documents read in place: 2 businessowners declarations, 3 Contractors Special Policy documents and 1 commercial package policy, which are not businessowners)"
    ],
    "recurring_wording_review": {
      "corpus": "POLICIES-FINAL-V3, original documents, read locally only",
      "documents_scanned": 57,
      "captions_kept": 290,
      "rule": "a line is kept only when it prints in 5 or more different documents of 2 or more carrier folders, has no digit run of 4 or more, and every word is itself used in 10 or more carrier folders; counts and codes only, no page text or value is stored"
    },
    "g1_bop_review": {
      "folder": "G1/bop",
      "documents_read": 6,
      "businessowners_declarations": 2,
      "carriers": [
        "Utica First Insurance Company",
        "New York Central Mutual Fire Insurance Company"
      ],
      "not_businessowners": {
        "contractors_special_policy": 3,
        "commercial_package_policy": 1
      },
      "rule": "a coverage name is added when a businessowners declarations in the folder prints it as a coverage row; labels and codes only, no page text or value is stored"
    }
  },
  "fideon:blocks_used": [
    "locations",
    "buildings"
  ],
  "fideon:lob_block": "None. Every concept the seeds print has a home in the envelope or a common-model building block (SPEC_21 4.2.4). Section I property rows a businessowners declarations prints beside its liability are coverages of this line under BOPGL_ codes; the business liability rows use BOPGL_ codes. The common model 1.3.0 releases the shared liability codes CR-BOPGL-01 asked for (X_BI_PD_LIABILITY, X_PRODUCTS_COMPLETED_OPS, X_DAMAGE_TO_PREMISES_RENTED, X_PERSONAL_ADVERTISING_INJURY); the rename to them is a major version of the line (CHANGE_REQUESTS_bopgl.md CR-BOPGL-01). bopgl and boppr print the same Section I property beside Section II liability: every row both lines print has a counterpart code on the other line (the `counterpart` key of the coverage-code file) and the same printed names.",
  "fideon:coverage_codes_file": "bopgl.coverage_codes.yaml",
  "fideon:coverage_codes": [
    "BOPGL_ACCOUNTS_RECEIVABLE",
    "BOPGL_ADDITIONAL_EXPENSE",
    "BOPGL_ADDITIONAL_TENANT_IMPROVEMENTS",
    "BOPGL_AGGREGATE_PER_PROJECT",
    "BOPGL_ANTENNAS_SIGNS",
    "BOPGL_APPURTENANT_STRUCTURES",
    "BOPGL_ARSON_REWARD",
    "BOPGL_AUTOMOBILE_LIABILITY",
    "BOPGL_AUTO_INCREASE_BUILDING",
    "BOPGL_BI_DEPENDENT_PROPERTIES",
    "BOPGL_BI_OFF_PREMISES_OPERATIONS",
    "BOPGL_BI_ORDINARY_PAYROLL",
    "BOPGL_BI_UTILITY_SERVICES",
    "BOPGL_BI_WEBSITES",
    "BOPGL_BLANKET_ADDITIONAL_INSURED",
    "BOPGL_BPP",
    "BOPGL_BPP_ENHANCEMENT",
    "BOPGL_BPP_OFF_PREMISES",
    "BOPGL_BPP_OF_OTHERS",
    "BOPGL_BPP_REPLACEMENT_COST",
    "BOPGL_BPP_STORAGE_UNITS",
    "BOPGL_BRANDS_LABELS",
    "BOPGL_BUILDING",
    "BOPGL_BUILDING_OFF_PREMISES",
    "BOPGL_BUILDING_PROPERTY_OF_OTHERS",
    "BOPGL_CIVIL_AUTHORITY",
    "BOPGL_CLAIM_EXPENSE",
    "BOPGL_COLLAPSE",
    "BOPGL_COMPUTERS_WORLDWIDE",
    "BOPGL_COMPUTER_COVERAGE",
    "BOPGL_COMPUTER_OPERATIONS",
    "BOPGL_CONTRACTORS_EQUIPMENT",
    "BOPGL_CONTRACTORS_POLLUTION",
    "BOPGL_CONTRACTOR_BROADENING",
    "BOPGL_CONTRACT_PENALTIES",
    "BOPGL_COUNTERFEIT_MONEY",
    "BOPGL_CREDIT_CARD_FORGERY",
    "BOPGL_CREDIT_CARD_RECEIPTS",
    "BOPGL_CYBER_VIRUS_MALWARE",
    "BOPGL_DAMAGE_TO_PREMISES_RENTED",
    "BOPGL_DATA_BREACH_DEFENSE",
    "BOPGL_DATA_BREACH_RESPONSE",
    "BOPGL_DATA_RECORDS",
    "BOPGL_DATA_RESTORATION",
    "BOPGL_DEBRIS_REMOVAL",
    "BOPGL_DEMOLITION",
    "BOPGL_DESIGNATED_PREMISES",
    "BOPGL_DETACHED_TRAILERS",
    "BOPGL_ELECTRONIC_DATA",
    "BOPGL_EMPLOYEE_DISHONESTY",
    "BOPGL_EPL",
    "BOPGL_EXPEDITING_EXPENSES",
    "BOPGL_EXTENDED_BUSINESS_INCOME",
    "BOPGL_EXTORTION_THREATS",
    "BOPGL_FAILSAFE_EO",
    "BOPGL_FINE_ARTS",
    "BOPGL_FIRE_DEPT_SERVICE",
    "BOPGL_FIRE_EXTINGUISHER_RECHARGE",
    "BOPGL_FORGERY",
    "BOPGL_FRAUDULENT_TRANSFER",
    "BOPGL_GLASS_EXPENSE",
    "BOPGL_HAZARDOUS_SUBSTANCES",
    "BOPGL_IDENTITY_RECOVERY",
    "BOPGL_INCREASED_COST_CONSTRUCTION",
    "BOPGL_INVENTORY_APPRAISAL",
    "BOPGL_LEASEHOLD_IMPROVEMENTS",
    "BOPGL_LEASE_ASSESSMENT",
    "BOPGL_LIABILITY",
    "BOPGL_LIMITED_FUNGUS",
    "BOPGL_LIQUOR_LIABILITY",
    "BOPGL_LOCK_KEY",
    "BOPGL_LOSS_OF_EARNINGS",
    "BOPGL_LOSS_OF_INCOME",
    "BOPGL_LOSS_OF_INCOME_LIMIT",
    "BOPGL_LOST_KEYS",
    "BOPGL_MONEY_SECURITIES",
    "BOPGL_NEWLY_ACQUIRED_BPP",
    "BOPGL_NEWLY_ACQUIRED_BUILDINGS",
    "BOPGL_NEWLY_ACQUIRED_PROPERTY",
    "BOPGL_ORDINANCE_OR_LAW",
    "BOPGL_OUTDOOR_PROPERTY",
    "BOPGL_OUTDOOR_SIGNS",
    "BOPGL_PAIRS_OR_SETS",
    "BOPGL_PAVED_SURFACES",
    "BOPGL_PERSONAL_EFFECTS",
    "BOPGL_PERSONAL_INJURY",
    "BOPGL_PERSONAL_PROPERTY_OFF_PREMISES",
    "BOPGL_POLLUTANT_CLEANUP",
    "BOPGL_PRESERVATION_OF_PROPERTY",
    "BOPGL_PRODUCTS_COMPLETED_OPS",
    "BOPGL_SALESPERSONS_SAMPLES",
    "BOPGL_SEASONAL_INCREASE",
    "BOPGL_SEWER_BACKUP",
    "BOPGL_SIGNS",
    "BOPGL_SIGNS_OFF_PREMISES",
    "BOPGL_SPOILAGE",
    "BOPGL_STRETCH_PLUS_BLANKET",
    "BOPGL_SUMP_BACKUP",
    "BOPGL_TENANTS_LEGAL_LIABILITY",
    "BOPGL_THEFT_DAMAGE_BUILDING",
    "BOPGL_TRANSIT",
    "BOPGL_TRANSIT_BUSINESS_INCOME",
    "BOPGL_TREES_SHRUBS",
    "BOPGL_UMBRELLA_LIABILITY",
    "BOPGL_UNAUTHORIZED_CARD_USE",
    "BOPGL_UTILITY_INTERRUPTION",
    "BOPGL_UTILITY_SERVICES_DIRECT",
    "BOPGL_VALUABLE_PAPERS",
    "BOPGL_WATER_DAMAGE",
    "X_ADDITIONAL_INSURED",
    "X_CYBER",
    "X_EQUIPMENT_BREAKDOWN",
    "X_HIRED_NONOWNED_AUTO",
    "X_MED_PAY",
    "X_WAIVER_OF_SUBROGATION"
  ],
  "fideon:mandatory_fields": [
    "carrier.name",
    "named_insured.primary_name",
    "policy.policy_number",
    "policy.effective_date",
    "policy.expiration_date",
    "coverages[].limits[].amount"
  ],
  "fideon:audit_rules": [
    "policy.effective_date < policy.expiration_date",
    "months_between(policy.effective_date, policy.expiration_date) == policy.term_months",
    "policy.effective_date <= document.transaction_effective_date <= policy.expiration_date",
    "len(coverages[].limits[]) >= 1",
    "`coverages[coverage_code=BOPGL_LIABILITY].limits[limit_type=per_occurrence].amount` <= `coverages[coverage_code=BOPGL_LIABILITY].limits[limit_type=aggregate].amount`"
  ],
  "fideon:audit_rules_note": "Rules 1-4 are common_model.json fideon:default_audit_rules (the claims-made rule left out: a businessowners liability declarations is occurrence-based and prints no retroactive date). Rule 5: an each-occurrence liability limit never exceeds its aggregate. No premium-sum rule: the coterie declarations print one policy premium (taxes, surcharges and fees included) and no coverage premiums. A rule whose values a document does not print is not evaluated.",
  "fideon:aliases": {
    "billing.account_number": [
      "Account ID"
    ],
    "billing.bill_type": [
      "Billing Type"
    ],
    "buildings[].area_sq_ft": [
      "Square Foot",
      "Square Footage"
    ],
    "buildings[].building_number": [
      "BUILDING NUMBER"
    ],
    "buildings[].construction": [
      "Construction Type"
    ],
    "buildings[].occupancy": [
      "Description of Building Occupancies"
    ],
    "buildings[].protective_devices": [
      "Protective Safeguard Credit (SF-53)"
    ],
    "buildings[].year_built": [
      "Year Constructed"
    ],
    "carrier.fax": [
      "Fax"
    ],
    "carrier.name": [
      "UNDERWRITING COMPANY",
      "Insurance Provided By"
    ],
    "carrier.phone": [
      "Phone"
    ],
    "coverages[].deductibles[].amount": [
      "DEDUCTIBLE",
      "Deductible"
    ],
    "coverages[].limits[].amount": [
      "LIMIT OF INSURANCE/EXTENDED NUMBER OF DAYS",
      "LIMIT",
      "COVERAGE LIMIT"
    ],
    "coverages[].premium": [
      "PREMIUM"
    ],
    "coverages[].valuation": [
      "Settlement - Building",
      "ACTUAL CASH VALUE OF BUILDING OPTION (YES OR NO)"
    ],
    "deductibles[].amount": [
      "PROPERTY DEDUCTIBLE",
      "Property Damage Liability Deductible",
      "Deductible"
    ],
    "deductibles[].percentage": [
      "WINDSTORM OR HAIL % DEDUCTIBLE"
    ],
    "document.issue_date": [
      "Policy Issued"
    ],
    "document.transaction_effective_date": [
      "Transaction Effective"
    ],
    "interested_parties[].address": [
      "LIENHOLDER ADDRESS/MORTGAGEE ADDRESS"
    ],
    "interested_parties[].loan_number": [
      "Loan Number"
    ],
    "interested_parties[].name": [
      "LIENHOLDER NAME/MORTGAGEE NAME",
      "1st Mortgagee",
      "Lenders Loss Payable",
      "LOSS PAYEE NAME/ADDRESS"
    ],
    "locations[].address": [
      "PREMISE ADDRESS"
    ],
    "locations[].distance_to_fire_station": [
      "Miles to Fire Department"
    ],
    "locations[].distance_to_hydrant": [
      "Feet to Hydrant"
    ],
    "locations[].location_number": [
      "PREMISE NUMBER",
      "Property"
    ],
    "locations[].protection_class": [
      "Protection Class"
    ],
    "locations[].territory": [
      "Zone"
    ],
    "named_insured.business_description": [
      "BUSINESS DESCRIPTION",
      "Business Operations"
    ],
    "named_insured.doing_business_as": [
      "DBA"
    ],
    "named_insured.email": [
      "EMAIL"
    ],
    "named_insured.entity_type": [
      "Insured Is"
    ],
    "named_insured.mailing_address": [
      "BUSINESS ADDRESS"
    ],
    "named_insured.phone": [
      "PHONE NUMBER"
    ],
    "named_insured.primary_name": [
      "NAMED INSURED (Business or Individual)",
      "Named Insured(s)"
    ],
    "policy.effective_date": [
      "POLICY PERIOD",
      "Policy Term Effective Date"
    ],
    "policy.expiration_date": [
      "POLICY PERIOD",
      "Policy Term Expiration Date"
    ],
    "policy.original_inception_date": [
      "Inception Date"
    ],
    "policy.policy_number": [
      "POLICY NUMBER",
      "Policy Number",
      "Policy ID"
    ],
    "policy.policy_type": [
      "Policy Type"
    ],
    "policy.term_months": [
      "Term Length"
    ],
    "premium.taxes_fees[].amount": [
      "Fees",
      "NYS INS FEE",
      "NY FIRE FEE"
    ],
    "premium.total": [
      "POLICY PREMIUM",
      "Policy Premium",
      "Total",
      "Total Premium",
      "Annual Premium"
    ],
    "producer.agency_name": [
      "Agency",
      "Mail To"
    ],
    "producer.contact_name": [
      "Licensed Producer",
      "CONTACT NAME"
    ],
    "producer.fax": [
      "Fax"
    ],
    "producer.phone": [
      "Work"
    ]
  },
  "type": "object",
  "additionalProperties": false,
  "required": [
    "document",
    "carrier",
    "named_insured",
    "policy",
    "lob_parts",
    "coverages"
  ],
  "properties": {
    "document": {
      "$ref": "../common/common_model.json#/$defs/document"
    },
    "carrier": {
      "$ref": "../common/common_model.json#/$defs/carrier"
    },
    "producer": {
      "$ref": "../common/common_model.json#/$defs/producer"
    },
    "named_insured": {
      "$ref": "../common/common_model.json#/$defs/named_insured"
    },
    "policy": {
      "$ref": "../common/common_model.json#/$defs/policy"
    },
    "lob_parts": {
      "$ref": "../common/common_model.json#/$defs/lob_parts"
    },
    "coverages": {
      "$ref": "../common/common_model.json#/$defs/coverages"
    },
    "deductibles": {
      "$ref": "../common/common_model.json#/$defs/deductibles"
    },
    "interested_parties": {
      "$ref": "../common/common_model.json#/$defs/interested_parties"
    },
    "premium": {
      "$ref": "../common/common_model.json#/$defs/premium"
    },
    "billing": {
      "$ref": "../common/common_model.json#/$defs/billing"
    },
    "forms_and_endorsements": {
      "$ref": "../common/common_model.json#/$defs/forms_and_endorsements"
    },
    "locations": {
      "$ref": "../common/common_model.json#/$defs/locations"
    },
    "buildings": {
      "$ref": "../common/common_model.json#/$defs/buildings"
    },
    "additional_fields": {
      "$ref": "../common/common_model.json#/$defs/additional_fields"
    },
    "text_sections": {
      "$ref": "../common/common_model.json#/$defs/text_sections"
    },
    "fideon:provenance": {
      "$ref": "../common/common_model.json#/$defs/provenance"
    }
  }
}
